{
  "$schema":"https://json-schema.org/draft/2020-12/schema",
  "$id":"https://raw.githubusercontent.com/raillen/prumo/main/schemas/documentation-profile.schema.json",
  "type":"object",
  "required":["id","version","capabilities","contracts"],
  "properties": {
    "id":{"type":"string","minLength":1},
    "version":{"type":"integer","minimum":1},
    "description":{"type":"string"},
    "capabilities":{"type":"array","items":{"type":"string"}},
    "extends":{"type":"array","items":{"type":"string"}},
    "contracts":{"type":"array","items":{"type":"string"}},
    "excluded_contracts":{"type":"array","items":{"type":"string"}}
  },
  "additionalProperties":false
}
